### ISSUE TITLE
ip6的問題

### ISSUE THREAD

**Issue by sih4sing5hong5** [twgo/tw-on-youtube#26]
https://github.com/twgo/tw-on-youtube/blob/master/docker-compose.yml#L9

可能是這爿造成ip6

- [x] ip 4
- [x] tcpdump

REF
- ssh tunnel https://www.ubuntu-tw.org/modules/newbb/viewtopic.php?viewmode=compact&topic_id=17538
- http://www.linuxjournal.com/content/use-ssh-create-http-proxy

**Comment by sih4sing5hong5** [comment]
127.0.0.1是localhost一定連袂起--裡
我揣文章一下

**Comment by sih4sing5hong5** [comment]
你先看vbird，若看了，咱才約時間，我共你解釋原因
1. http://linux.vbird.org/linux_server/0110network_basic.php#tcpip_network
2. http://linux.vbird.org/linux_server/0140networkcommand.php
3. http://linux.vbird.org/linux_server/0230router.php

**Comment by leo424y** [comment]
收到，我先惡補一下vbird大神教材再請你解釋

**Comment by leo424y** [comment]
```
(172.16.3.116)ubuntu@twgo-dl:~/youtube-dl-go/tw-on-youtube$ sudo tcpdump -i ens3 -nn port 3000

(172.16.3.115)ubuntu@twgo-ci:~$ curl 172.16.3.116:3000

(172.16.3.116)
tcpdump: verbose output suppressed, use -v or -vv for full protocol decode
listening on ens3, link-type EN10MB (Ethernet), capture size 262144 bytes
11:45:49.764589 IP 172.16.3.115.42182 > 172.16.3.116.3000: Flags [S], seq 2783242194, win 29200, options [mss 1460,sackOK,TS val 516133749 ecr 0,nop,wscale 7], length 0
11:45:49.764915 IP 172.16.3.116.3000 > 172.16.3.115.42182: Flags [S.], seq 2134172063, ack 2783242195, win 28960, options [mss 1460,sackOK,TS val 516082930 ecr 516133749,nop,wscale 7], length 0
11:45:49.765343 IP 172.16.3.115.42182 > 172.16.3.116.3000: Flags [.], ack 1, win 229, options [nop,nop,TS val 516133749 ecr 516082930], length 0
11:45:49.765439 IP 172.16.3.115.42182 > 172.16.3.116.3000: Flags [P.], seq 1:82, ack 1, win 229, options [nop,nop,TS val 516133749 ecr 516082930], length 81
11:45:49.765471 IP 172.16.3.116.3000 > 172.16.3.115.42182: Flags [.], ack 82, win 227, options [nop,nop,TS val 516082930 ecr 516133749], length 0
11:45:49.812966 IP 172.16.3.116.3000 > 172.16.3.115.42182: Flags [.], seq 1:2897, ack 82, win 227, options [nop,nop,TS val 516082942 ecr 516133749], length 2896
11:45:49.813020 IP 172.16.3.116.3000 > 172.16.3.115.42182: Flags [P.], seq 2897:3073, ack 82, win 227, options [nop,nop,TS val 516082942 ecr 516133749], length 176
11:45:49.813283 IP 172.16.3.115.42182 > 172.16.3.116.3000: Flags [.], ack 3073, win 277, options [nop,nop,TS val 516133761 ecr 516082942], length 0
11:45:49.813513 IP 172.16.3.115.42182 > 172.16.3.116.3000: Flags [F.], seq 82, ack 3073, win 277, options [nop,nop,TS val 516133761 ecr 516082942], length 0
11:45:49.813672 IP 172.16.3.116.3000 > 172.16.3.115.42182: Flags [F.], seq 3073, ack 83, win 227, options [nop,nop,TS val 516082942 ecr 516133761], length 0
11:45:49.813836 IP 172.16.3.115.42182 > 172.16.3.116.3000: Flags [.], ack 3074, win 277, options [nop,nop,TS val 516133761 ecr 516082942], length 0
```
但在自己電腦 curl 172.16.3.116:3000 會timeout
且(172.16.3.116)sudo tcpdump -i ens3 -nn port 3000 無連入資訊

**Comment by leo424y** [comment]
確定目前VM互連OK。掛VPN還是連不上的話，不如new個有gui的VM來連 XD

**Comment by sih4sing5hong5** [comment]
你會當ssh，ssh是port22
tcpdump分別試 22, 80, 3000，自你的電腦+vpn連看覓，看有啥差

因為你愛ssh入去才會當試，所以先ssh到另外一台vm，才連去youtube vm
tcpdump指定vpn的ip，按呢就袂花-sah-sah

**Comment by sih4sing5hong5** [comment]
若是22會使，其他袂使，就是資訊室的問題，愛直接共問

**Comment by leo424y** [comment]
好的，謝謝丞宏說明，我再試，不行就找資訊室

**Comment by leo424y** [comment]
解了！！大開腦洞，謝謝丞宏指點！！
`ssh -NfL 12345:172.16.3.116:3000 ubuntu@172.16.3.115`
之後就能正常連，所以未來使用前也得先吃這一帖

參考
- https://www.ubuntu-tw.org/modules/newbb/viewtopic.php?viewmode=compact&topic_id=17538

**Comment by sih4sing5hong5** [comment]
你是用ssh tunnel，按呢會無法度demo予老師看（抑是這無重要 XD）

所以直接連3000袂使的問題嘛是愛揣出來
看是資訊室抑是佗位的問題

**Comment by leo424y** [comment]
XD沒錯，目前沒法讓老師直接用；好的，我再聯絡資訊室

**Comment by sih4sing5hong5** [comment]
> tcpdump分別試 22, 80, 3000閣其他port（1234,8080…），自你的電腦+vpn連看覓，看有啥差

這的結果是啥

**Comment by leo424y** [comment]
掛ssh tunnel 連的結果，沒掛沒有，看起來就變tunnel那台IP在連了
```
ubuntu@twgo-dl:~$ sudo tcpdump -nn -i ens3 'port 3000'
sudo: unable to resolve host twgo-dl
tcpdump: verbose output suppressed, use -v or -vv for full protocol decode
listening on ens3, link-type EN10MB (Ethernet), capture size 262144 bytes
13:56:32.902785 IP 172.16.3.115.42558 > 172.16.3.116.3000: Flags [P.], seq 4109900692:4109903915, ack 3846242276, win 273, options [nop,nop,TS val 561294533 ecr 561240214], length 3223
13:56:32.903074 IP 172.16.3.116.3000 > 172.16.3.115.42558: Flags [.], ack 3223, win 328, options [nop,nop,TS val 561243714 ecr 561294533], length 0
13:56:32.935530 IP 172.16.3.116.3000 > 172.16.3.115.42558: Flags [.], seq 1:2897, ack 3223, win 328, options [nop,nop,TS val 561243723 ecr 561294533], length 2896
13:56:32.935579 IP 172.16.3.116.3000 > 172.16.3.115.42558: Flags [P.], seq 2897:3073, ack 3223, win 328, options [nop,nop,TS val 561243723 ecr 561294533], length 176
13:56:32.935913 IP 172.16.3.115.42558 > 172.16.3.116.3000: Flags [.], ack 3073, win 321, options [nop,nop,TS val 561294542 ecr 561243723], length 0
```

**Comment by leo424y** [comment]
原來是openstack有擋，已增開80/443/3000群組
```
Hi 使用者你好，

原因是openstack 內有防火牆機制，預設我們進入只開port 22 及3389
其餘要自行在安全性群組增加規則，我已經先幫你加好你要開的port 
如果你之後想再增加其他port 可登入到openstack 運算-->存取權以及安全-->管理規則
內新增。
有其他問題在煩請與我聯繫
```
已把 lfs, twgo-ci, twgo-exp, twgo-dl 設定可用這些port
